[
   {"code": "43849", "title": "Diversite et evolution des organismes vivants", "label": "Divers.Evo.", "parcours": "sdv", "year": "s1"} ,
   {"code": "43912", "title": "Methodologies", "label": "Metho.", "parcours": "sdv", "year": "s1"} ,
   {"code": "43875", "title": "Modelisation mathematique en biologie", "label": "Mod.Math", "parcours": "sdv", "year": "s1"} ,
   {"code": "43879", "title": "Modelisation mathematique en biologie CM01", "label": "CM Section1", "parcours": "sdv", "year": "s1-mod math"} ,
   {"code": "43876", "title": "Modelisation mathematique en biologie CM02", "label": "CM Section2", "parcours": "sdv", "year": "s1-mod math"} ,
   {"code": "43881", "title": "Modelisation mathematique en biologie TD01", "label": "TD01", "parcours": "sdv", "year": "s1-mod math"} ,
   {"code": "43885", "title": "Modelisation mathematique en biologie TD02", "label": "TD02", "parcours": "sdv", "year": "s1-mod math"} ,
   {"code": "43880", "title": "Modelisation mathematique en biologie TD03", "label": "TD03", "parcours": "sdv", "year": "s1-mod math"} ,
   {"code": "43882", "title": "Modelisation mathematique en biologie TD04", "label": "TD04", "parcours": "sdv", "year": "s1-mod math"} ,
   {"code": "43877", "title": "Modelisation mathematique en biologie TD05", "label": "TD05", "parcours": "sdv", "year": "s1-mod math"} ,
   {"code": "43883", "title": "Modelisation mathematique en biologie TD06", "label": "TD06", "parcours": "sdv", "year": "s1-mod math"} ,
   {"code": "43884", "title": "Modelisation mathematique en biologie TD07", "label": "TD07", "parcours": "sdv", "year": "s1-mod math"} ,
   {"code": "43878", "title": "Modelisation mathematique en biologie TD08", "label": "TD08", "parcours": "sdv", "year": "s1-mod math"} ,
   {"code": "21987", "title": "Modelisation mathematique en biologie TDDL", "label": "TD DL", "parcours": "sdv", "year": "s1-mod math"} ,
   {"code": "43821", "title": "Physiologie cellulaire", "label": "Physio.", "parcours": "sdv", "year": "s1"} ,
   {"code": "43886", "title": "Thermochimie et equilibres en solution", "label": "Thermoch.", "parcours": "sdv", "year": "s1"} ,
   {"code": "44157", "title": "Biochimie des macromolecules biologiques", "label": "Biochi.", "parcours": "sdv", "year": "s3"} ,
   {"code": "44260", "title": "Biodiversite marine en zone intertidale", "label": "Biodiv.", "parcours": "sdv", "year": "s3"} ,
   {"code": "44071", "title": "Biologie cellulaire et moleculaire 2", "label": "Bio cell.", "parcours": "sdv", "year": "s3"} ,
   {"code": "44281", "title": "Biologie des champignons", "label": "B.Champi.", "parcours": "sdv", "year": "s3"} ,
   {"code": "44098", "title": "Biologie integrative animale et vegetale 1", "label": "B.Int.Anim.Veg.", "parcours": "sdv", "year": "s3"} ,
   {"code": "44190", "title": "Biologie moleculaire et genetique 2", "label": "B.Mol&Gen", "parcours": "sdv", "year": "s3"} ,
   {"code": "44241", "title": "Biostatistiques 1 : probabilites, statistiques", "label": "Biostat1", "parcours": "sdv", "year": "s3"} ,
   {"code": "44314", "title": "Conference Interdisciplinaire", "label": "Conf.", "parcours": "sdv", "year": "s3"} ,
   {"code": "44289", "title": "Construction du raisonnement scientifique", "label": "Raisonmt.", "parcours": "sdv", "year": "s3"} ,
   {"code": "44298", "title": "Diversite du developpement chez les especes modeles animales", "label": "Diversite", "parcours": "sdv", "year": "s3"} ,
   {"code": "44311", "title": "Espace game moleculaire", "label": "Esp.G.Mol.", "parcours": "sdv", "year": "s3"} ,
   {"code": "44292", "title": "Introduction a la medecine experimentale Claude Bernard", "label": "Intro.Med.Exp", "parcours": "sdv", "year": "s3"} ,
   {"code": "44295", "title": "Les bio-industries et leurs metiers", "label": "Bioindust.", "parcours": "sdv", "year": "s3"} ,
   {"code": "44218", "title": "Mathematiques pour les biologistes", "label": "Math", "parcours": "sdv", "year": "s3"} ,
   {"code": "44225", "title": "Mathematiques pour les biologistes CM01", "label": "CM", "parcours": "sdv", "year": "s3-math pr bio"} ,
   {"code": "44226", "title": "Mathematiques pour les biologistes TD01", "label": "TD01", "parcours": "sdv", "year": "s3-math pr bio"} ,
   {"code": "44228", "title": "Mathematiques pour les biologistes TD02", "label": "TD02", "parcours": "sdv", "year": "s3-math pr bio"} ,
   {"code": "44227", "title": "Mathematiques pour les biologistes TD03", "label": "TD03", "parcours": "sdv", "year": "s3-math pr bio"} ,
   {"code": "44219", "title": "Mathematiques pour les biologistes TD04", "label": "TD04", "parcours": "sdv", "year": "s3-math pr bio"} ,
   {"code": "44220", "title": "Mathematiques pour les biologistes TD05", "label": "TD05", "parcours": "sdv", "year": "s3-math pr bio"} ,
   {"code": "44221", "title": "Mathematiques pour les biologistes TD06", "label": "TD06", "parcours": "sdv", "year": "s3-math pr bio"} ,
   {"code": "44222", "title": "Mathematiques pour les biologistes TD07", "label": "TD07", "parcours": "sdv", "year": "s3-math pr bio"} ,
   {"code": "44224", "title": "Mathematiques pour les biologistes TD08", "label": "TD08", "parcours": "sdv", "year": "s3-math pr bio"} ,
   {"code": "44223", "title": "Mathematiques pour les biologistes TD09", "label": "TD09", "parcours": "sdv", "year": "s3-math pr bio"} ,
   {"code": "44229", "title": "Reactivite et analyse de molecules biologiques", "label": "React&ana.", "parcours": "sdv", "year": "s3"} ,
   {"code": "44308", "title": "Sciences et societe", "label": "Sci&Soc", "parcours": "sdv", "year": "s3"}
]
