[
   {"code": "6361", "title": "Physique1", "label": "PHY1", "parcours": "phys", "year": "l1", "page": ["licence"]} ,
   {"code": "6362", "title": "Physique2", "label": "PHY2", "parcours": "phys", "year": "l1", "page": ["licence"]} ,
   {"code": "6363", "title": "Physique3", "label": "PHY3", "parcours": "phys", "year": "l1", "page": ["licence"]} ,
   {"code": "6371", "title": "Physique4", "label": "PHY4", "parcours": "phys", "year": "l1", "page": ["licence"]} ,
   {"code": "6639", "title": "Physique5", "label": "PHY5", "parcours": "phys", "year": "l1", "page": ["licence"]} ,
   {"code": "39539", "title": "Rebon1", "label": "REB1", "parcours": "phys", "year": "l1", "page": ["licence"]} ,
   {"code": "39540", "title": "Rebon2", "label": "REB2", "parcours": "phys", "year": "l1", "page": ["licence"]} ,
   {"code": "obso-phyl1", "title": "AncVersion", "label": "obsolète", "parcours": "phys", "year": "l1", "page": ["licence"], "annexe": true} ,
   {"code": "11274", "title": "MEDPHY", "label": "MEDPHY", "parcours": "phys", "year": "l2", "page": ["licence"]} ,
   {"code": "6742", "title": "Physique1", "label": "PHY1", "parcours": "phys", "year": "l2", "page": ["licence"]} ,
   {"code": "6743", "title": "Physique2", "label": "PHY2", "parcours": "phys", "year": "l2", "page": ["licence"]} ,
   {"code": "6744", "title": "Physique3", "label": "PHY3", "parcours": "phys", "year": "l2", "page": ["licence"]} ,
   {"code": "6675", "title": "PHYTECH", "label": "PHYTECH", "parcours": "phys", "year": "l2", "page": ["licence"]} ,
   {"code": "obso-phyl2", "title": "AncVersion", "label": "obsolète", "parcours": "phys", "year": "l2", "page": ["licence"], "annexe": true} ,
   {"code": "7866", "title": "L3 1-A", "label": "L3 1 - A", "parcours": "phys", "year": "l3-sem5", "page": ["licence"]} ,
   {"code": "7867", "title": "L3 1-B", "label": "L3 1 - B", "parcours": "phys", "year": "l3-sem5", "page": ["licence"]} ,
   {"code": "7868", "title": "L3 2-A", "label": "L3 2 - A", "parcours": "phys", "year": "l3-sem5", "page": ["licence"]} ,
   {"code": "7869", "title": "L3 2-B", "label": "L3 2 - B", "parcours": "phys", "year": "l3-sem5", "page": ["licence"]} ,
   {"code": "7870", "title": "L3 3-A", "label": "L3 3 - A", "parcours": "phys", "year": "l3-sem5", "page": ["licence"]} ,
   {"code": "7873", "title": "L3 3-B", "label": "L3 3 - B", "parcours": "phys", "year": "l3-sem5", "page": ["licence"]} ,
   {"code": "7871", "title": "L3 4-A", "label": "L3 4 - A", "parcours": "phys", "year": "l3-sem5", "page": ["licence"]} ,
   {"code": "7874", "title": "L3 4-B", "label": "L3 4 - B", "parcours": "phys", "year": "l3-sem5", "page": ["licence"]} ,
   {"code": "obso-physl3-sem5", "title": "AncVersion", "label": "obsolète", "parcours": "phys", "year": "l3-sem5", "page": ["licence"], "annexe": true} ,
   {"code": "5312", "title": "L3 E 1", "label": "L3 E 1", "parcours": "phys", "year": "l3-sem6", "page": ["licence"]} ,
   {"code": "5313", "title": "L3 E 2", "label": "L3 E 2", "parcours": "phys", "year": "l3-sem6", "page": ["licence"]} ,
   {"code": "5498", "title": "L3 T 1", "label": "L3 T 1", "parcours": "phys", "year": "l3-sem6", "page": ["licence"]} ,
   {"code": "5499", "title": "L3 T 2", "label": "L3 T 2", "parcours": "phys", "year": "l3-sem6", "page": ["licence"]} ,
   {"code": "5500", "title": "L3 T 3", "label": "L3 T 3", "parcours": "phys", "year": "l3-sem6", "page": ["licence"]} ,
   {"code": "obso-physl3-sem6", "title": "AncVersion", "label": "obsolète", "parcours": "phys", "year": "l3-sem6", "page": ["licence"], "annexe": true} ,
   {"code": "6016", "title": "M1 Phys", "label": "M1-Appli", "parcours": "phys", "year": "m1-sem1", "page": ["licence"]} ,
   {"code": "6015", "title": "M1 Phys", "label": "M1-Fonda1", "parcours": "phys", "year": "m1-sem1", "page": ["licence"]} ,
   {"code": "4864", "title": "M1 Phys", "label": "M1-Fonda2", "parcours": "phys", "year": "m1-sem1", "page": ["licence"]} ,
   {"code": "obso-physm1s1", "title": "AncVersion", "label": "obsolète", "parcours": "phys", "year": "m1-sem1", "page": ["licence"], "annexe": true} ,
   {"code": "1040", "title": "Salles condorcet TP", "label": "TP073A", "parcours": "phys", "year": "salles TP", "page": ["licence"]} ,
   {"code": "1251", "title": "Salles condorcet TP", "label": "TP075A", "parcours": "phys", "year": "salles TP", "page": ["licence"]} ,
   {"code": "1293", "title": "Salles condorcet TP", "label": "TP077A", "parcours": "phys", "year": "salles TP", "page": ["licence"]} ,
   {"code": "1016", "title": "Salles condorcet TP", "label": "TP156A", "parcours": "phys", "year": "salles TP", "page": ["licence"]} ,
   {"code": "1571", "title": "Salles condorcet TP", "label": "TP172A", "parcours": "phys", "year": "salles TP", "page": ["licence"]} ,
   {"code": "1541", "title": "Salles condorcet TP", "label": "TP173A", "parcours": "phys", "year": "salles TP", "page": ["licence"]} ,
   {"code": "1458", "title": "Salles condorcet TP", "label": "TP174A", "parcours": "phys", "year": "salles TP", "page": ["licence"]} ,
   {"code": "959", "title": "Salles condorcet TP", "label": "TP176A", "parcours": "phys", "year": "salles TP", "page": ["licence"]} ,
   {"code": "1636", "title": "Salles condorcet TP", "label": "TP192A", "parcours": "phys", "year": "salles TP", "page": ["licence"]} ,
   {"code": "1413", "title": "Salles condorcet TP", "label": "TP193A", "parcours": "phys", "year": "salles TP", "page": ["licence"]} ,
   {"code": "1354", "title": "Salles condorcet TP", "label": "TP250A", "parcours": "phys", "year": "salles TP", "page": ["licence"]} ,
   {"code": "1047", "title": "Salles condorcet TP", "label": "TP276A", "parcours": "phys", "year": "salles TP", "page": ["licence"]} ,
   {"code": "1294", "title": "Salles condorcet TP", "label": "TP285A", "parcours": "phys", "year": "salles TP", "page": ["licence"]} ,
   {"code": "1066", "title": "Salles condorcet TP", "label": "TP292A", "parcours": "phys", "year": "salles TP", "page": ["licence"]} ,
   {"code": "1565", "title": "Salles condorcet TP", "label": "TP293A", "parcours": "phys", "year": "salles TP", "page": ["licence"]} ,
   {"code": "1468", "title": "Salles condorcet TP", "label": "TP294A", "parcours": "phys", "year": "salles TP", "page": ["licence"]} ,
   {"code": "1343", "title": "Salles condorcet TP", "label": "TP313A", "parcours": "phys", "year": "salles TP", "page": ["licence"]} ,
   {"code": "1543", "title": "Salles condorcet TP", "label": "TP322A", "parcours": "phys", "year": "salles TP", "page": ["licence"]} ,
   {"code": "1028", "title": "Salles condorcet TP", "label": "TP338A", "parcours": "phys", "year": "salles TP", "page": ["licence"]}
]
