[
   {"code": "14516", "title": "Informatique1", "label": "INFO1", "parcours": "info", "year": "l1", "page": ["licence"]} ,
   {"code": "14517", "title": "Informatique2", "label": "INFO2", "parcours": "info", "year": "l1", "page": ["licence"]} ,
   {"code": "14518", "title": "Informatique3", "label": "INFO3", "parcours": "info", "year": "l1", "page": ["licence"]} ,
   {"code": "14521", "title": "Informatique4", "label": "INFO4", "parcours": "info", "year": "l1", "page": ["licence"]} ,
   {"code": "14520", "title": "Informatique5", "label": "INFO5", "parcours": "info", "year": "l1", "page": ["licence"]} ,
   {"code": "14519", "title": "Informatique6", "label": "INFO6", "parcours": "info", "year": "l1", "page": ["licence"], "annexe": true} ,
   {"code": "14525", "title": "Info/Bio", "label": "INFO BIO A", "parcours": "info", "year": "l1", "page": ["licence"]} ,
   {"code": "14524", "title": "Info/Bio", "label": "INFO BIO B", "parcours": "info", "year": "l1", "page": ["licence"]} ,
   {"code": "14523", "title": "Info/Jap", "label": "INFO JAP", "parcours": "info", "year": "l1", "page": ["licence"]} ,
   {"code": "14381", "title": "MathInfo 1", "label": "MathInfo1", "parcours": "info", "year": "l1", "page": ["licence"]} ,
   {"code": "14383", "title": "MathInfo 2", "label": "MathInfo2", "parcours": "info", "year": "l1", "page": ["licence"]} ,
   {"code": "obso-infol1", "title": "AncVersion", "label": "obsolète", "parcours": "info", "year": "l1", "page": ["licence"], "annexe": true} ,
   {"code": "14546", "title": "L2 Informatique1", "label": "INFO1", "parcours": "info", "year": "l2", "page": ["licence"]} ,
   {"code": "14552", "title": "L2 Informatique2", "label": "INFO2", "parcours": "info", "year": "l2", "page": ["licence"]} ,
   {"code": "14554", "title": "L2 Informatique3", "label": "INFO3", "parcours": "info", "year": "l2", "page": ["licence"]} ,
   {"code": "14557", "title": "L2 Informatique4", "label": "INFO4", "parcours": "info", "year": "l2", "page": ["licence"]} ,
   {"code": "14559", "title": "L2 Informatique5", "label": "INFO5", "parcours": "info", "year": "l2", "page": ["licence"]} ,
   {"code": "14576", "title": "Info/Bio", "label": "INFO BIO", "parcours": "info", "year": "l2", "page": ["licence"]} ,
   {"code": "14575", "title": "Info/Jap", "label": "INFO JAP", "parcours": "info", "year": "l2", "page": ["licence"]} ,
   {"code": "22129", "title": "MathInfo1", "label": "MathInfo1", "parcours": "info", "year": "l2", "page": ["licence"]} ,
   {"code": "22130", "title": "MathInfo2", "label": "MathInfo2", "parcours": "info", "year": "l2", "page": ["licence"], "annexe": true} ,
   {"code": "obso-infol2", "title": "AncVersion", "label": "obsolète", "parcours": "info", "year": "l2", "page": ["licence"], "annexe": true} ,
   {"code": "14543", "title": "L3 info", "label": "INFO1", "parcours": "info", "year": "l3", "page": ["licence"]} ,
   {"code": "14577", "title": "L3 info", "label": "INFO2", "parcours": "info", "year": "l3", "page": ["licence"]} ,
   {"code": "14579", "title": "L3 info", "label": "INFO3", "parcours": "info", "year": "l3", "page": ["licence"]} ,
   {"code": "14580", "title": "L3 info", "label": "INFO4", "parcours": "info", "year": "l3", "page": ["licence"]} ,
   {"code": "14581", "title": "L3 info", "label": "INFO5", "parcours": "info", "year": "l3", "page": ["licence"]} ,
   {"code": "14584", "title": "L3 info Bio", "label": "INFO BIO", "parcours": "info", "year": "l3", "page": ["licence"]} ,
   {"code": "14585", "title": "L3 info Jap", "label": "INFO JAP", "parcours": "info", "year": "l3", "page": ["licence"]} ,
   {"code": "22133", "title": "L3MathInfo1", "label": "INFO MATH", "parcours": "info", "year": "l3", "page": ["licence"]} ,
   {"code": "obso-infol3", "title": "AncVersion", "label": "obsolète", "parcours": "info", "year": "l3", "page": ["licence"], "annexe": true} ,
   {"code": "14599", "title": "M1 CRYPTO/MIC", "label": "M1 CRYPTO/MIC", "parcours": "info", "year": "m1"} ,
   {"code": "14588", "title": "M1 DATA", "label": "M1 DATA", "parcours": "info", "year": "m1"} ,
   {"code": "58594", "title": "M1 EIDD", "label": "M1 EIDD", "parcours": "info", "year": "m1"} ,
   {"code": "14590", "title": "M1 GENIAL", "label": "M1 GENIAL", "parcours": "info", "year": "m1"} ,
   {"code": "14589", "title": "M1 IMPAIRS", "label": "M1 IMPAIRS", "parcours": "info", "year": "m1"} ,
   {"code": "14595", "title": "M1 LP", "label": "M1 LP", "parcours": "info", "year": "m1"} ,
   {"code": "14596", "title": "M1 MPRI", "label": "M1 MPRI", "parcours": "info", "year": "m1"} ,
   {"code": "14602", "title": "M1 SDD/MIDS", "label": "M1 SDD/MIDS", "parcours": "info", "year": "m1"} ,
   {"code": "14617", "title": "M2 CRYPTO/MIC", "label": "M2 CRYPTO/MIC", "parcours": "info", "year": "m2"} ,
   {"code": "14620", "title": "M2 DATA", "label": "M2 DATA", "parcours": "info", "year": "m2"} ,
   {"code": "60821", "title": "M2 EIDD", "label": "M2 EIDD", "parcours": "info", "year": "m2"} ,
   {"code": "14627", "title": "M2 GENIAL", "label": "M2 GENIAL", "parcours": "info", "year": "m2"} ,
   {"code": "14623", "title": "M2 IMPAIRS", "label": "M2 IMPAIRS", "parcours": "info", "year": "m2"} ,
   {"code": "14622", "title": "M2 LP", "label": "M2 LP", "parcours": "info", "year": "m2"} ,
   {"code": "14626", "title": "M2 MPRI", "label": "M2 MPRI", "parcours": "info", "year": "m2"} ,
   {"code": "14629", "title": "M2 SDD/MIDS", "label": "M2 SDD/MIDS", "parcours": "info", "year": "m2"}
]
