[
   {"code": "6535", "title": "EPC", "label": "EPC", "parcours": "epc", "year": "l1", "page": ["licence"]} ,
   {"code": "6668", "title": "EPC", "label": "EPC", "parcours": "epc", "year": "l2", "page": ["licence"]} ,
   {"code": "11382", "title": "EPC", "label": "EPC", "parcours": "epc", "year": "l3", "page": ["licence"]}
]
