[
   {"code": "14381", "title": "MathInfo 1", "label": "MathInfo1", "parcours": "mathinfo", "year": "l1", "page": ["licence"]} ,
   {"code": "14383", "title": "MathInfo 2", "label": "MathInfo2", "parcours": "mathinfo", "year": "l1", "page": ["licence"]} ,
   {"code": "obso-mathinfol1", "title": "AncVersion", "label": "obsolète", "parcours": "mathinfo", "year": "l1", "page": ["licence"], "annexe": true} ,
   {"code": "AnglaisL3ufrmath.1", "title": "L3MFA Anglais", "label": "Angl.1", "parcours": "mathinfo", "year": "l3", "page": ["licence"]} ,
   {"code": "AnglaisL3ufrmath.2", "title": "L3MFA Anglais", "label": "Angl.2", "parcours": "mathinfo", "year": "l3", "page": ["licence"]} ,
   {"code": "AnglaisL3ufrmath.3", "title": "L3MFA Anglais", "label": "Angl.3", "parcours": "mathinfo", "year": "l3", "page": ["licence"]} ,
   {"code": "AnglaisL3ufrmath.4", "title": "L3MFA Anglais", "label": "Angl.4", "parcours": "mathinfo", "year": "l3", "page": ["licence"]} ,
   {"code": "AnglaisL3ufrmath.5", "title": "L3MFA Anglais", "label": "Angl.5", "parcours": "mathinfo", "year": "l3", "page": ["licence"]} ,
   {"code": "AnglaisL3ufrmath.6", "title": "L3MFA Anglais", "label": "Angl.6", "parcours": "mathinfo", "year": "l3", "page": ["licence"]} ,
   {"code": "22129", "title": "MathInfo1", "label": "MathInfo1", "parcours": "mathinfo", "year": "l2", "page": ["licence"]} ,
   {"code": "22130", "title": "MathInfo2", "label": "MathInfo2", "parcours": "mathinfo", "year": "l2", "page": ["licence"]} ,
   {"code": "obso-mathinfol2", "title": "AncVersion", "label": "obsolète", "parcours": "mathinfo", "year": "l2", "page": ["licence"], "annexe": true} ,
   {"code": "22133", "title": "L3MathInfo1", "label": "MathInfo1", "parcours": "mathinfo", "year": "l3", "page": ["licence"]} ,
   {"code": "obso-mathinfol3", "title": "AncVersion", "label": "obsolète", "parcours": "mathinfo", "year": "l3", "page": ["licence"], "annexe": true} ,
   {"code": "59387", "title": "M1 Maths Info Crypto", "label": "M1 MIC", "parcours": "mathinfo", "year": "m1", "page": ["licence"]} ,
   {"code": "47495", "title": "M1 Maths Info Data Science", "label": "M1 MISD", "parcours": "mathinfo", "year": "m1", "page": ["licence"]} ,
   {"code": "obso-mathinfom1", "title": "AncVersion", "label": "obsolète", "parcours": "mathinfo", "year": "m1", "page": ["licence"], "annexe": true} ,
   {"code": "59404", "title": "M2 Maths Info Crypto", "label": "M2 MIC", "parcours": "mathinfo", "year": "m2", "page": ["licence"]} ,
   {"code": "59188", "title": "M2 Maths Info Science Donnees", "label": "M2 MISD", "parcours": "mathinfo", "year": "m2", "page": ["licence"]} ,
   {"code": "obso-mathinfom2", "title": "AncVersion", "label": "obsolète", "parcours": "mathinfo", "year": "m2", "page": ["licence"], "annexe": true} ,
   {"code": "1200", "title": "Salle TP UFR Math", "label": "TP 2004", "parcours": "mathinfo", "year": "salles TP", "page": ["licence"]} ,
   {"code": "1515", "title": "Salle TP UFR Math", "label": "TP 2005", "parcours": "mathinfo", "year": "salles TP", "page": ["licence"]} ,
   {"code": "1279", "title": "Salle TP UFR Math", "label": "TP 2006", "parcours": "mathinfo", "year": "salles TP", "page": ["licence"]} ,
   {"code": "3839.tutorat", "title": "Tutorat", "label": "Tutorat", "parcours": "mathinfo", "year": "ufr-divers", "page": ["licence"]}
]
