[
   {"code": "14422", "title": "MiashsEco1", "label": "ECO1", "parcours": "miashs", "year": "l1", "page": ["licence"]} ,
   {"code": "14423", "title": "MiashsEco2", "label": "ECO2", "parcours": "miashs", "year": "l1", "page": ["licence"]} ,
   {"code": "14425", "title": "MiashsEco3", "label": "ECO3", "parcours": "miashs", "year": "l1", "page": ["licence"]} ,
   {"code": "14426", "title": "MiashsEco4", "label": "ECO4", "parcours": "miashs", "year": "l1", "page": ["licence"]} ,
   {"code": "14415", "title": "MiashsGéo", "label": "GEO", "parcours": "miashs", "year": "l1", "page": ["licence"]} ,
   {"code": "14418", "title": "MiashsHis", "label": "HIST", "parcours": "miashs", "year": "l1", "page": ["licence"]} ,
   {"code": "14419", "title": "MiashsLing", "label": "LING", "parcours": "miashs", "year": "l1", "page": ["licence"]} ,
   {"code": "14420", "title": "MiashsSoc", "label": "SOCIO", "parcours": "miashs", "year": "l1", "page": ["licence"]} ,
   {"code": "obso-miashsl1", "title": "AncVersion", "label": "obsolète", "parcours": "miashs", "year": "l1", "page": ["licence"], "annexe": true} ,
   {"code": "11217.sem2", "title": "AnglaisL2fusionnes", "label": "Angl.L2", "parcours": "miashs", "year": "l2", "page": ["licence"]} ,
   {"code": "14463", "title": "MiashsEco1", "label": "ECO1", "parcours": "miashs", "year": "l2", "page": ["licence"]} ,
   {"code": "14464", "title": "MiashsEco2", "label": "ECO2", "parcours": "miashs", "year": "l2", "page": ["licence"]} ,
   {"code": "14466", "title": "MiashsEco3", "label": "ECO3", "parcours": "miashs", "year": "l2", "page": ["licence"]} ,
   {"code": "14470", "title": "MiashsGéog", "label": "GEO", "parcours": "miashs", "year": "l2", "page": ["licence"]} ,
   {"code": "14471", "title": "MiashsHisto", "label": "HIST", "parcours": "miashs", "year": "l2", "page": ["licence"]} ,
   {"code": "14472", "title": "MiashsLingu", "label": "LING", "parcours": "miashs", "year": "l2", "page": ["licence"]} ,
   {"code": "14475", "title": "MiashsSocio", "label": "SOCIO", "parcours": "miashs", "year": "l2", "page": ["licence"]} ,
   {"code": "obso-miashsl2", "title": "AncVersion", "label": "obsolète", "parcours": "miashs", "year": "l2", "page": ["licence"], "annexe": true} ,
   {"code": "5666.sem2", "title": "AnglaisL3fusionnes", "label": "Angl.L3", "parcours": "miashs", "year": "l3", "page": ["licence"]} ,
   {"code": "14504", "title": "MiashsECO1", "label": "L3Miashs1", "parcours": "miashs", "year": "l3", "page": ["licence"]} ,
   {"code": "14505", "title": "MiashsECO2", "label": "L3Miashs2", "parcours": "miashs", "year": "l3", "page": ["licence"]} ,
   {"code": "obso-miashsl3", "title": "AncVersion", "label": "obsolète", "parcours": "miashs", "year": "l3", "page": ["licence"], "annexe": true} ,
   {"code": "46992", "title": "L3 MIASHS - Prof des Ecoles", "label": "L3 PDE", "parcours": "miashs", "year": "l3-pde", "page": ["licence"]} ,
   {"code": "14419", "title": "MiashsLing", "label": "L1Miashs", "parcours": "miashs", "year": "ling", "page": ["licence"]} ,
   {"code": "37117", "title": "uelibreling", "label": "Option L1-L2", "parcours": "miashs", "year": "ling", "page": ["licence"]} ,
   {"code": "sallesuelibreling.LL012Y", "title": "uelibreling", "label": "Option_L1-L2", "parcours": "miashs", "year": "ling", "page": ["licence"]} ,
   {"code": "37266", "title": "inititation ling. gen", "label": "Init.Ling.Gen", "parcours": "miashs", "year": "ling", "page": ["licence"]} ,
   {"code": "14472", "title": "MiashsLingu", "label": "L2Miashs", "parcours": "miashs", "year": "ling", "page": ["licence"]} ,
   {"code": "11217.sem2", "title": "AnglaisL2fusionnes", "label": "Angl.L2", "parcours": "miashs", "year": "ling", "page": ["licence"]} ,
   {"code": "14504", "title": "MiashsLing1", "label": "L3Miashs1", "parcours": "miashs", "year": "ling", "page": ["licence"]} ,
   {"code": "14505", "title": "MiashsLing2", "label": "L3Miashs2", "parcours": "miashs", "year": "ling", "page": ["licence"]} ,
   {"code": "4549", "title": "MiashsLinginfo", "label": "L3Miashs-ling", "parcours": "miashs", "year": "ling", "page": ["licence"], "annexe": true} ,
   {"code": "5271.l3sdl_l3miashs", "title": "L3SDL-LI", "label": "L3SDL-LI", "parcours": "miashs", "year": "ling", "page": ["licence"]} ,
   {"code": "5666.sem2", "title": "AnglaisL3fusionnes", "label": "Angl.L3", "parcours": "miashs", "year": "ling", "page": ["licence"]} ,
   {"code": "3839.tutorat", "title": "Tutorat", "label": "Tutorat", "parcours": "miashs", "year": "ufr-divers", "page": ["licence"]} ,
   {"code": "sesmiashs1", "title": "", "label": "SES-Gr1", "parcours": "miashs", "year": "l3"} ,
   {"code": "sesmiashs2", "title": "", "label": "SES-Gr2", "parcours": "miashs", "year": "l3"}
]
