[
   {"code": "5633", "title": "CHIM1", "label": "CHIM1", "parcours": "chimie", "year": "l1", "page": ["licence"]} ,
   {"code": "5634", "title": "CHIM2", "label": "CHIM2", "parcours": "chimie", "year": "l1", "page": ["licence"]} ,
   {"code": "5635", "title": "CHIM3", "label": "CHIM3", "parcours": "chimie", "year": "l1", "page": ["licence"]} ,
   {"code": "5636", "title": "CHIM4", "label": "CHIM4", "parcours": "chimie", "year": "l1", "page": ["licence"]} ,
   {"code": "5637", "title": "L1CHIMBio1", "label": "CHIM BIO1", "parcours": "chimie", "year": "l1", "page": ["licence"]} ,
   {"code": "obso-chiml1", "title": "AncVersion", "label": "obsolète", "parcours": "chimie", "year": "l1", "page": ["licence"], "annexe": true} ,
   {"code": "5638", "title": "CHIM1", "label": "CHIM1", "parcours": "chimie", "year": "l2", "page": ["licence"]} ,
   {"code": "5639", "title": "CHIM2", "label": "CHIM2", "parcours": "chimie", "year": "l2", "page": ["licence"]} ,
   {"code": "5640", "title": "CHIM3", "label": "CHIM3", "parcours": "chimie", "year": "l2", "page": ["licence"]} ,
   {"code": "5641", "title": "L2CHIMBIO1", "label": "CHIM BIO1", "parcours": "chimie", "year": "l2", "page": ["licence"]} ,
   {"code": "obso-chiml2", "title": "AncVersion", "label": "obsolète", "parcours": "chimie", "year": "l2", "page": ["licence"], "annexe": true} ,
   {"code": "5711", "title": "L3CHIM1", "label": "CHIM1", "parcours": "chimie", "year": "l3", "page": ["licence"]} ,
   {"code": "5712", "title": "L3CHIM2", "label": "CHIM2", "parcours": "chimie", "year": "l3", "page": ["licence"]} ,
   {"code": "5713", "title": "L3CHIM3", "label": "CHIM3", "parcours": "chimie", "year": "l3", "page": ["licence"]} ,
   {"code": "5715", "title": "L3CHIM4", "label": "CHIM4", "parcours": "chimie", "year": "l3", "page": ["licence"]} ,
   {"code": "8160", "title": "L3CHIMBIO", "label": "CHIM BIO1", "parcours": "chimie", "year": "l3", "page": ["licence"]} ,
   {"code": "5708", "title": "M1 Chim Gr1", "label": "M1-PhysC1", "parcours": "chimie", "year": "m1", "page": ["licence"]} ,
   {"code": "5709", "title": "M1 Chim Gr2", "label": "M1-PhysC2", "parcours": "chimie", "year": "m1", "page": ["licence"]} ,
   {"code": "6065", "title": "M1 Chim Gr3", "label": "M1-MolC1", "parcours": "chimie", "year": "m1", "page": ["licence"]} ,
   {"code": "6200", "title": "M1 Chim Gr4", "label": "M1-MolC2", "parcours": "chimie", "year": "m1", "page": ["licence"]} ,
   {"code": "42638", "title": "M1 Chim RE Saints-Peres", "label": "M1-MolC3", "parcours": "chimie", "year": "m1", "page": ["licence"], "annexe": true} ,
   {"code": "21593", "title": "M1 Chim RE", "label": "M1-Chim RE", "parcours": "chimie", "year": "m1-re", "page": ["licence"]} ,
   {"code": "6020", "title": "M1 Chim RE", "label": "M1-Chim RE Gr1", "parcours": "chimie", "year": "m1-re", "page": ["licence"]} ,
   {"code": "8390", "title": "M1 Chim RE", "label": "M1-Chim RE Gr2", "parcours": "chimie", "year": "m1-re", "page": ["licence"]} ,
   {"code": "8391", "title": "M1 Chim RE", "label": "M1-Chim RE Gr3", "parcours": "chimie", "year": "m1-re", "page": ["licence"]} ,
   {"code": "8392", "title": "M1 Chim RE", "label": "M1-Chim RE Gr4", "parcours": "chimie", "year": "m1-re", "page": ["licence"]} ,
   {"code": "6213", "title": "M2 Chim Gr1", "label": "M2-CHENS", "parcours": "chimie", "year": "m2", "page": ["licence"]} ,
   {"code": "6214", "title": "M2 Chim Gr2", "label": "M2-SAFE", "parcours": "chimie", "year": "m2", "page": ["licence"]} ,
   {"code": "6259", "title": "M2 Chim Gr3", "label": "M2-PCLife", "parcours": "chimie", "year": "m2", "page": ["licence"]} ,
   {"code": "6215", "title": "M2 Chim Gr4", "label": "M2-OBMC", "parcours": "chimie", "year": "m2", "page": ["licence"]} ,
   {"code": "6342", "title": "M2 Chim", "label": "M2-Chim.Gr5", "parcours": "chimie", "year": "m2", "page": ["licence"], "annexe": true} ,
   {"code": "6500", "title": "M2 Chim", "label": "M2-Chim.Gr6", "parcours": "chimie", "year": "m2", "page": ["licence"], "annexe": true}
]
