[
   {"code": "1276", "title": "Halle - 11E - 147", "label": "11E", "parcours": "zz-halle", "year": "Amphis cinema"} ,
   {"code": "1418", "title": "Halle - 7C - 147", "label": "7C", "parcours": "zz-halle", "year": "Amphis cinema"} ,
   {"code": "1274", "title": "Halle - 10E - 147", "label": "10E", "parcours": "zz-halle", "year": "Amphis"} ,
   {"code": "1257", "title": "Halle - 12E - 147", "label": "12E", "parcours": "zz-halle", "year": "Amphis"} ,
   {"code": "1182", "title": "Halle - 4C - 147", "label": "4C", "parcours": "zz-halle", "year": "Amphis"} ,
   {"code": "1219", "title": "Halle - 5C - 147", "label": "5C", "parcours": "zz-halle", "year": "Amphis"} ,
   {"code": "1298", "title": "Halle - 6C - 147", "label": "6C", "parcours": "zz-halle", "year": "Amphis"} ,
   {"code": "1273", "title": "Halle - 9E - 147", "label": "9E", "parcours": "zz-halle", "year": "Amphis"} ,
   {"code": "1416", "title": "Halle - 13E - 238", "label": "13E", "parcours": "zz-halle", "year": "Amphis 200p"} ,
   {"code": "1020", "title": "Halle - 1A - 276 - Ernest Vilgrain", "label": "1A", "parcours": "zz-halle", "year": "Amphis 200p"} ,
   {"code": "1013", "title": "Halle - 2A - 276", "label": "2A", "parcours": "zz-halle", "year": "Amphis 200p"} ,
   {"code": "1154", "title": "Halle - 8C - 238", "label": "8C", "parcours": "zz-halle", "year": "Amphis 200p"} ,
   {"code": "1271", "title": "Halle - 3B - 132", "label": "3B", "parcours": "zz-halle", "year": "Amphis plats"} ,
   {"code": "1245", "title": "Halle - 580F - 90", "label": "580F", "parcours": "zz-halle", "year": "Amphis plats"} ,
   {"code": "1469", "title": "Halle - 165E - 52", "label": "165E", "parcours": "zz-halle", "year": "Salles 52p"} ,
   {"code": "1687", "title": "Halle - 278F - 52", "label": "278F", "parcours": "zz-halle", "year": "Salles 52p"} ,
   {"code": "1498", "title": "Halle - 279F - 52", "label": "279F", "parcours": "zz-halle", "year": "Salles 52p"} ,
   {"code": "1619", "title": "Halle - 378F - 52", "label": "378F", "parcours": "zz-halle", "year": "Salles 52p"} ,
   {"code": "1686", "title": "Halle - 410B - 52", "label": "410B", "parcours": "zz-halle", "year": "Salles 52p"} ,
   {"code": "1316", "title": "Halle - 478F - 52", "label": "478F", "parcours": "zz-halle", "year": "Salles 52p"} ,
   {"code": "1084", "title": "Halle - 479F - 52", "label": "479F", "parcours": "zz-halle", "year": "Salles 52p"} ,
   {"code": "1482", "title": "Halle - 379F - 60", "label": "379F", "parcours": "zz-halle", "year": "Salles 60-70p"} ,
   {"code": "1615", "title": "Halle - 027C - 70", "label": "027C", "parcours": "zz-halle", "year": "Salles 60-70p"} ,
   {"code": "1368", "title": "Halle - 064E - 70", "label": "064E", "parcours": "zz-halle", "year": "Salles 60-70p"} ,
   {"code": "1489", "title": "Halle - 226C - 70", "label": "226C", "parcours": "zz-halle", "year": "Salles 60-70p"} ,
   {"code": "1102", "title": "Halle - 227C - 69", "label": "227C", "parcours": "zz-halle", "year": "Salles 60-70p"} ,
   {"code": "1551", "title": "Halle - 264E - 70", "label": "264E", "parcours": "zz-halle", "year": "Salles 60-70p"} ,
   {"code": "1225", "title": "Halle - 265E - 70", "label": "265E", "parcours": "zz-halle", "year": "Salles 60-70p"} ,
   {"code": "1520", "title": "Halle - 418C - 70", "label": "418C", "parcours": "zz-halle", "year": "Salles 60-70p"} ,
   {"code": "1552", "title": "Halle - 419C - 70", "label": "419C", "parcours": "zz-halle", "year": "Salles 60-70p"} ,
   {"code": "1510", "title": "Halle - 470E - 70", "label": "470E", "parcours": "zz-halle", "year": "Salles 60-70p"} ,
   {"code": "1620", "title": "Halle - 471E - 70", "label": "471E", "parcours": "zz-halle", "year": "Salles 60-70p"} ,
   {"code": "1300", "title": "Halle - 234C - 84", "label": "234C", "parcours": "zz-halle", "year": "Salles 84p"} ,
   {"code": "1664", "title": "Halle - 247E - 84", "label": "247E", "parcours": "zz-halle", "year": "Salles 84p"}
]
