[
   {"code": "AnglaisL3ufrmath.1", "title": "L3MFA Anglais", "label": "Angl.1", "parcours": "ingemath", "year": "l3", "page": ["licence"]} ,
   {"code": "AnglaisL3ufrmath.2", "title": "L3MFA Anglais", "label": "Angl.2", "parcours": "ingemath", "year": "l3", "page": ["licence"]} ,
   {"code": "AnglaisL3ufrmath.3", "title": "L3MFA Anglais", "label": "Angl.3", "parcours": "ingemath", "year": "l3", "page": ["licence"]} ,
   {"code": "AnglaisL3ufrmath.4", "title": "L3MFA Anglais", "label": "Angl.4", "parcours": "ingemath", "year": "l3", "page": ["licence"]} ,
   {"code": "AnglaisL3ufrmath.5", "title": "L3MFA Anglais", "label": "Angl.5", "parcours": "ingemath", "year": "l3", "page": ["licence"]} ,
   {"code": "AnglaisL3ufrmath.6", "title": "L3MFA Anglais", "label": "Angl.6", "parcours": "ingemath", "year": "l3", "page": ["licence"]} ,
   {"code": "22145", "title": "INGEMath", "label": "IngeMath1", "parcours": "ingemath", "year": "l3", "page": ["licence"]}
]
